name,description,category,subcategory,url
fh5_telemetry,Forza Horizon 5 telemetry with Python,Telemetry & Data Analysis,Forza,https://github.com/xxr0ss/fh5_telemetry
ForzaTelemetryToExcel,API for logging FH5 telemetry to Excel,Telemetry & Data Analysis,Forza,https://github.com/SantCineva/ForzaTelemetryToExcel
forza-telemetry-dash,Real-time telemetry dashboard for Forza Horizon 5,Telemetry & Data Analysis,Forza,https://github.com/kekn9ne/forza-telemetry-dash
forza-data-web,Forza real-time telemetry receiver web application,Telemetry & Data Analysis,Forza,https://github.com/geeooff/forza-data-web
SIMRacingAppsWebContent,Web-based apps and widgets for SIMRacingApps,Streaming & Overlays,,https://github.com/SIMRacingApps/SIMRacingAppsWebContent
SIMRacingAppsElectron,Electron app launcher for SIMRacingApps,Streaming & Overlays,,https://github.com/SIMRacingApps/SIMRacingAppsElectron
OpenRaceDirector,Race director tools for open sim racing,League Management,,https://github.com/OpenSimTools/RaceDirector
simhub-gaps-overlay,SimHub relative leaderboard overlay for ACC,Streaming & Overlays,,https://github.com/serek4/simhub-gaps-overlay
pygauge,Python/Arduino TM1638 display for DiRT Rally telemetry,DIY Hardware,Dashboard,https://github.com/Billiam/pygauge
dirt-rally-telemetry-dashboard,Simple telemetry dashboard for DiRT Rally 2.0,Telemetry & Data Analysis,Dirt Rally,https://github.com/gabrielgouv/dirt-rally-telemetry-dashboard
openFFB,Use consumer FFB wheels on arcade racing cabs,Hardware & Force Feedback,,https://github.com/Fredobedo/openFFB
t150_driver,Linux driver for Thrustmaster T150/TMX wheels,Hardware & Force Feedback,,https://github.com/scarburato/t150_driver
pysumo,Python module for running SUMO traffic simulations,Simulation Platforms,,https://github.com/bstriner/pysumo
panda3d-simplepbr,Simple physically-based rendering for Panda3D games,Game Development,,https://github.com/Moguri/panda3d-simplepbr
racecar-gym,Gym environment for miniature racecar using pybullet,AI & Machine Learning,,https://github.com/axelbr/racecar_gym
DDPG-Keras-Torcs,Deep Deterministic Policy Gradient for TORCS with Keras,AI & Machine Learning,,https://github.com/yanpanlau/DDPG-Keras-Torcs
formula1-telemetry,Java library for F1 game UDP telemetry parsing,Telemetry & Data Analysis,Formula 1,https://github.com/ppatierno/formula1-telemetry
f1-telemetry-client,Node UDP client for F1 game telemetry,Telemetry & Data Analysis,Formula 1,https://github.com/racehub-io/f1-telemetry-client
f122_telemetry_parser,Python CLI tool for F1 22 UDP telemetry parsing,Telemetry & Data Analysis,Formula 1,https://github.com/kens-git/f122_telemetry_parser
rfactortools,Python tools for rFactor modding and conversion,Game Tools,rFactor,https://github.com/Grumbel/rfactortools
rf2_video_settings,Create rFactor 2 video setting presets,Game Tools,rFactor,https://github.com/tappi287/rf2_video_settings
ACC-Server-Control,Management platform for ACC dedicated servers (Vue/.NET),Game Tools,Assetto Corsa,https://github.com/StarkBotha/ACC-Server-Control
acc-server-manager-api,API for managing multiple ACC server instances,Game Tools,Assetto Corsa,https://github.com/fre-sch/acc-server-manager-api
